{
  "$schema": "https://json-schema.org/draft/2020-12/schema",
  "$id": "nexus-exploit-artifact-v1.schema.json",
  "title": "Nexus exploit artifact v1",
  "type": "object",
  "additionalProperties": false,
  "required": [
    "schema",
    "title",
    "description",
    "claim_target",
    "security_impact",
    "environment",
    "submitter",
    "protocol_expectation",
    "replay_expectation",
    "genesis_state",
    "events",
    "receipts",
    "notes"
  ],
  "properties": {
    "schema": {
      "const": "nexus-exploit-artifact-v1"
    },
    "title": {
      "$ref": "#/$defs/nonemptyText"
    },
    "description": {
      "$ref": "#/$defs/nonemptyText"
    },
    "claim_target": {
      "$ref": "#/$defs/claimTarget"
    },
    "security_impact": {
      "enum": ["CRITICAL", "HIGH", "MEDIUM", "LOW", "INFO"]
    },
    "environment": {
      "$ref": "#/$defs/environment"
    },
    "submitter": {
      "$ref": "#/$defs/submitter"
    },
    "protocol_expectation": {
      "$ref": "#/$defs/protocolExpectation"
    },
    "replay_expectation": {
      "$ref": "#/$defs/replayExpectation"
    },
    "genesis_state": {
      "type": "object"
    },
    "events": {
      "type": "array",
      "maxItems": 10000,
      "items": {
        "$ref": "#/$defs/event"
      }
    },
    "receipts": {
      "type": "array",
      "maxItems": 10000,
      "items": {
        "$ref": "#/$defs/receipt"
      }
    },
    "notes": {
      "type": "array",
      "maxItems": 64,
      "items": {
        "type": "string",
        "maxLength": 4096
      }
    }
  },
  "$defs": {
    "nonemptyText": {
      "type": "string",
      "minLength": 1,
      "maxLength": 4096
    },
    "root": {
      "type": "string",
      "pattern": "^[0-9a-f]{64}$"
    },
    "errorCode": {
      "type": "string",
      "pattern": "^ERR_[A-Z0-9_]+$"
    },
    "base64url": {
      "type": "string",
      "pattern": "^[A-Za-z0-9_-]+$"
    },
    "claimTarget": {
      "type": "object",
      "additionalProperties": false,
      "required": ["kind", "identifier", "statement"],
      "properties": {
        "kind": {
          "enum": ["FALSIFIER", "SPEC_VECTOR", "OTHER"]
        },
        "identifier": {
          "type": "string",
          "pattern": "^(F-[0-9]{2}|V-[0-9]{3}|[A-Z][A-Z0-9_-]{2,63})$"
        },
        "statement": {
          "$ref": "#/$defs/nonemptyText"
        }
      }
    },
    "environment": {
      "type": "object",
      "additionalProperties": false,
      "required": ["implementation_revision", "runtime", "runtime_version"],
      "properties": {
        "implementation_revision": {
          "type": "string",
          "pattern": "^(UNCOMMITTED|[0-9a-f]{7,64})$"
        },
        "runtime": {
          "$ref": "#/$defs/nonemptyText"
        },
        "runtime_version": {
          "$ref": "#/$defs/nonemptyText"
        }
      }
    },
    "submitter": {
      "type": "object",
      "additionalProperties": false,
      "required": [
        "alias",
        "provider_family",
        "operator_id",
        "identity_attestation"
      ],
      "properties": {
        "alias": {
          "$ref": "#/$defs/nonemptyText"
        },
        "provider_family": {
          "$ref": "#/$defs/nonemptyText"
        },
        "operator_id": {
          "$ref": "#/$defs/nonemptyText"
        },
        "identity_attestation": {
          "enum": ["OPERATOR_OBSERVED", "SELF_REPORTED", "UNKNOWN"]
        }
      }
    },
    "protocolExpectation": {
      "type": "object",
      "additionalProperties": false,
      "required": ["outcome", "reason_code"],
      "properties": {
        "outcome": {
          "enum": ["ACCEPT", "REJECT"]
        },
        "reason_code": {
          "oneOf": [
            {
              "$ref": "#/$defs/errorCode"
            },
            {
              "type": "null"
            }
          ]
        }
      }
    },
    "replayExpectation": {
      "type": "object",
      "additionalProperties": false,
      "required": [
        "outcome",
        "error_code",
        "expected_final_application_state_root",
        "expected_final_receipt_chain_root"
      ],
      "properties": {
        "outcome": {
          "enum": ["ACCEPT", "REJECT"]
        },
        "error_code": {
          "oneOf": [
            {
              "$ref": "#/$defs/errorCode"
            },
            {
              "type": "null"
            }
          ]
        },
        "expected_final_application_state_root": {
          "$ref": "#/$defs/root"
        },
        "expected_final_receipt_chain_root": {
          "oneOf": [
            {
              "$ref": "#/$defs/root"
            },
            {
              "type": "null"
            }
          ]
        }
      }
    },
    "hybridEventAuth": {
      "type": "object",
      "additionalProperties": false,
      "required": [
        "scheme",
        "key_id",
        "controller_id",
        "signed_domain",
        "signed_payload_root",
        "ed25519_signature_base64url",
        "ml_dsa_65_signature_base64url"
      ],
      "properties": {
        "scheme": {
          "const": "HYBRID_ED25519_ML_DSA_65_V1"
        },
        "key_id": {
          "type": "string",
          "pattern": "^HYBRIDKEY-[0-9a-f]{64}$"
        },
        "controller_id": {
          "type": "string",
          "minLength": 1,
          "maxLength": 256
        },
        "signed_domain": {
          "const": "NEXUS_EVENT_AUTH_V2"
        },
        "signed_payload_root": {
          "$ref": "#/$defs/root"
        },
        "ed25519_signature_base64url": {
          "allOf": [
            {
              "$ref": "#/$defs/base64url"
            },
            {
              "minLength": 86,
              "maxLength": 86
            }
          ]
        },
        "ml_dsa_65_signature_base64url": {
          "allOf": [
            {
              "$ref": "#/$defs/base64url"
            },
            {
              "minLength": 4412,
              "maxLength": 4412
            }
          ]
        }
      }
    },
    "event": {
      "type": "object",
      "additionalProperties": false,
      "required": [
        "schema",
        "event_type",
        "actor_id",
        "authority_root",
        "policy_root",
        "expected_predecessor_root",
        "tick",
        "nonce",
        "idempotency_key",
        "payload",
        "event_id",
        "auth"
      ],
      "properties": {
        "schema": {
          "const": "nexus-event-v1"
        },
        "event_type": {
          "type": "string",
          "pattern": "^[A-Z][A-Z0-9_]*$"
        },
        "actor_id": {
          "type": "string",
          "minLength": 1,
          "maxLength": 256
        },
        "authority_root": {
          "$ref": "#/$defs/root"
        },
        "policy_root": {
          "$ref": "#/$defs/root"
        },
        "expected_predecessor_root": {
          "$ref": "#/$defs/root"
        },
        "tick": {
          "type": "integer",
          "minimum": 0,
          "maximum": 9007199254740991
        },
        "nonce": {
          "$ref": "#/$defs/nonemptyText"
        },
        "idempotency_key": {
          "$ref": "#/$defs/nonemptyText"
        },
        "payload": {
          "type": "object"
        },
        "event_id": {
          "type": "string",
          "pattern": "^EVT-[0-9a-f]{64}$"
        },
        "auth": {
          "$ref": "#/$defs/hybridEventAuth"
        }
      }
    },
    "receipt": {
      "type": "object",
      "additionalProperties": false,
      "required": [
        "receipt_id",
        "schema",
        "sequence",
        "event_id",
        "event_type",
        "actor_id",
        "job_id",
        "predecessor_root",
        "next_state_root",
        "semantic_event_root",
        "semantic_receipt_id",
        "semantic_receipt_root",
        "authenticated_event_root",
        "effects_root",
        "result_root",
        "invariants_root",
        "logical_tick",
        "previous_receipt_root",
        "previous_semantic_receipt_root"
      ],
      "properties": {
        "receipt_id": {
          "type": "string",
          "pattern": "^RCPT-[0-9a-f]{64}$"
        },
        "schema": {
          "const": "nexus-receipt-v2"
        },
        "sequence": {
          "type": "integer",
          "minimum": 1,
          "maximum": 9007199254740991
        },
        "event_id": {
          "type": "string",
          "pattern": "^EVT-[0-9a-f]{64}$"
        },
        "event_type": {
          "type": "string",
          "pattern": "^[A-Z][A-Z0-9_]*$"
        },
        "actor_id": {
          "$ref": "#/$defs/nonemptyText"
        },
        "job_id": {
          "type": ["string", "null"]
        },
        "predecessor_root": {
          "$ref": "#/$defs/root"
        },
        "next_state_root": {
          "$ref": "#/$defs/root"
        },
        "semantic_event_root": {
          "$ref": "#/$defs/root"
        },
        "semantic_receipt_id": {
          "type": "string",
          "pattern": "^SRCPT-[0-9a-f]{64}$"
        },
        "semantic_receipt_root": {
          "$ref": "#/$defs/root"
        },
        "authenticated_event_root": {
          "$ref": "#/$defs/root"
        },
        "effects_root": {
          "$ref": "#/$defs/root"
        },
        "result_root": {
          "$ref": "#/$defs/root"
        },
        "invariants_root": {
          "$ref": "#/$defs/root"
        },
        "logical_tick": {
          "type": "integer",
          "minimum": 0,
          "maximum": 9007199254740991
        },
        "previous_receipt_root": {
          "oneOf": [
            {
              "$ref": "#/$defs/root"
            },
            {
              "type": "null"
            }
          ]
        },
        "previous_semantic_receipt_root": {
          "oneOf": [
            {
              "$ref": "#/$defs/root"
            },
            {
              "type": "null"
            }
          ]
        }
      }
    }
  }
}
